,title,company,salary,summary
34,Gestionnaire Production,Add Value Assurances,,"ADD VALUE ASSURANCES  Recherche sa/son Gestionnaire Production IARD pro CDI Paris La Défense    PRÉSENTATION DE L'ENTREPRISE PME à taille humaine, Add Value Assurances est la 1ère place de courtage du marché français. Spécialistes du risque d’entreprise IARD, nous proposons une offre de prestations de services unique sur le marché couvrant l’ensemble de la chaîne de valeur : aide au placement, gestion de portefeuille, gestion de sinistres, mise en conformité, digitalisation et formation. Le modèle de notre entreprise repose sur la digitalisation des process de souscription et la mise à disposition d’une équipe de spécialistes, destinés à optimiser l’efficacité et la rentabilité des assureurs et intermédiaires en assurances au travers de 3 canaux : Courtage (réseau de plus 3 500 courtiers) Partenariats (banque assurance) Affinitaire (Syndicats professionnels, Fédérations) Basée au cœur de Paris La Défense, Add Value Assurances est fondée en 2013 par Benoit Salembier. Dès 2014, Add Value Assurances reçoit un Trophée du Courtage récompensant l’originalité de son modèle de distribution. Pour accélérer son développement, Add Value Assurances rejoint en octobre 2019 le groupe ACTURIS Ltd (UK) www.acturis.com, leader européen des solutions informatiques à destination du secteur de l’assurance. En complément d’Add value Assurances, ACTURIS France est créé en 2021 pour distribuer ses solutions digitales aux courtiers et assureurs français.  DESCRIPTION DU POSTE  Pour répondre à notre croissance nous recherchons un/une gestionnaire de production, rattaché(e) au Responsable de pôle, vous aurez la charge du suivi post-souscription de l’ensemble des contrats professionnels (RC, Multirisques professionnelle, Flotte Automobile, Auto-Mission, RC des Dirigeants, PJ, Construction, etc) en étroite relation avec nos courtiers partenaires et les assureurs. Vos missions principales sont : Répondre aux diverses demandes des courtiers et des clients (par téléphone ou par mail) Etablir des avenants (Régularisation de chiffre d'affaires, changement de fractionnement résiliation) et procéder à des modifications administratives Gérer le renouvellement des contrats, Gérer le suivi des contrats en contentieux primes Avoir un rôle transverse avec les autres équipes (placement, sinistres, comptabilité) Toutes ces missions doivent être effectuées dans le respect des process internes et dans les délais impartis, gage de notre qualité de travail et de notre réactivité PROFIL RECHERCHÉ Vous êtes diplômé d’un Bac+2/Bac+3 minimum Vous justifiez d’une expérience professionnelle réussie d’au moins 2 ans dans un poste de gestionnaire IARD (Cabinet de courtage ou Compagnie) Vous êtes rigoureux(se), organisé(e), dynamique et avez l’esprit équipe Vous vous reconnaissez dans le respect des valeurs, l’investissement, la volonté de bien faire, la responsabilité, la confiance, l’écoute et la satisfaction client Vous faites preuve d’un excellent relationnel, avez le sens de l’écoute et maîtrisez les codes de la relation client La connaissance des outils extranets des compagnies Allianz, Axa, Generali et MMA est un + REMUNERATION Selon expérience DIVERS L’équipe est actuellement composée de 4 personnes en Production et 2 personnes en Sinistres POURQUOI REJOINDRE ADD VALUE ? Participer aux projets d’une entreprise en pleine croissance au cœur de la digitalisation. Travailler au sein d’une équipe dynamique dans nos bureaux de Paris La Défense. Vous êtes intéressé(e) par cette opportunité, merci de postuler en envoyant votre CV avec une lettre de motivation à jobs@add-value.fr il y a 16 jours - Continuer pour postuler Signaler l'offre"
35,STAGE - SERVICE JURIDIQUE EN BANQUE H/F,CREDIT AGRICOLE DE CHAMPAGNE,,"Métier Risques / Audit / Juridique / Contentieux Titre du poste STAGE - SERVICE JURIDIQUE EN BANQUE H/F Description du poste Vous êtes étudiant(e) en Master 1 spécialisé en Droit des Affaires Intéressé(e) par le domaine bancaire ? A la recherche d’un stage de 4 à 6 mois ?  Notre service Juridique basé à Auxerre, vous accueille et vous accompagne pour vous permettre d’appréhender le métier de juriste dans l’univers de la Banque/Assurance. Nos experts vous forment, pour exemple, à : Contribuer au référencement de l’ensemble des conventions / contrats engageant notre Caisse Régionale (saisie dans l’outil/ numérisation/ identification des caractéristiques des conventions, etc), Conseiller en matière de droit des affaires, droit bancaire, droit des majeurs protégés, ... Participer aux activités en lien avec le droit des sociétés du service : préparation des Assemblées Générales, réalisation des formalités légales, des modifications statutaires etc. Appuyer notre juriste pour valider les communications publicitaires et promotionnelles de notre Caisse, Rédiger, lire, valider des contrats de notre Caisse et de ses filiales. Profil Pour réussir ce stage Vous avez des capacités pour : Vous intégrer facilement au sein d’une équipe Analyser et synthétiser Apprendre et vous adapter Rédiger et contrôler avec rigueur. Pour postuler, adresser votre CV et lettre de motivation à : recrutement@ca-cb.fr  Contrat Stage Localisation du poste Localisation du poste Bourgogne-Franche-Comté, Yonne (89) Lieu de travail AUXERRE Critères candidat Niveau d'études min. requis Bac+3 il y a 7 jours - Continuer pour postuler Signaler l'offre"
36,Stagiaire au sein de l'Ã©quipe Transports et Arbitrage Inter...,Reed Smith LLP,,"Description de l'annonce : Notre équipe – composée, à Paris, de deux associés, 1 counsel et de 6 collaborateurs – accompagne, conseille et défend des P&I Clubs et des compagnies d’assurance de premier plan, des sociétés de classification, des compagnies d’assistance, des armateurs, des négociants et des affréteurs. Elle est dotée de fortes compétences contentieuses dans les domaines maritime, commercial et du commerce international. Le Cabinet traite également des dossiers d’arbitrage en lien avec les secteurs maritime et des infrastructures et impliquant la région de l’Afrique du Nord et de l’Ouest. La base de clientèle est très diversifiée. La pratique Shipping du bureau de Paris couvre tous les aspects du droit des transports et du commerce international : litiges en matière de charte partie et de pollution, assurance transport, douanes, négoce, transport maritime, aérien et terrestre de marchandises et de passagers, … Vous êtes Elève Avocat et/ou titulaire d'un Master 2 en Droit International des Affaires. Vous parlez couramment l’anglais et le rédigez parfaitement. Vous avez effectué un ou plusieurs stages en cabinet d’avocats et/ou en entreprise. Vous souhaitez enrichir votre parcours par une expérience concrète et stimulante au sein d’une équipe dynamique, et effectuer un stage au sein d’une structure à taille humaine, entrepreneuriale dans un environnement international. N’hésitez pas à nous adresser vos candidatures par email en postulant ci-dessus.  A propos de Reed Smith Le cabinet d'avocats Reed Smith - fondé à Pittsburgh en 1877 - compte plus de 1800 avocats répartis dans 30 bureaux en Europe, au Moyen-Orient, en Asie et aux Etats-Unis. Créé en 2005, le bureau parisien de Reed Smith regroupe aujourd’hui plus de 70 avocats et juristes dont 23 associés qui interviennent en Arbitrage interne et international, Assurances et réassurances, Banque/Finance, Capital investissement/Fusions & acquisitions/Droit Boursier/Droit des sociétés, Concurrence & Droit Européen, Contentieux /Résolution des litiges, Droit de la santé, Droit de la sécurité sociale, Droit du travail, Droit Public, Droit fiscal, Droit immobilier, Droit pénal des affaires, Environnement, Maritime, Transports et Commerce international, Prévention et gestion des risques professionnels, sanitaires ou industriels, Propriété Intellectuelle, Restructuration, Energies Naturelles et Renouvelables.  Informations complémentaires : Durée de contrat (si CDD ou intérim ou stage) : 6 mois Date d'entrée en poste : 1er juillet 2021 Revenu proposé : En fonction du niveau d'Ã©tude du candidat Niveau d'anglais demandé : Bilingue Adresse web du Recruteur : https://www.reedsmith.com Fonction : Collaborateurs libéraux / salariés, et stages Village de la justice il y a 2 jours - Continuer pour postuler Signaler l'offre"
37,CDD Conseiller Commercial H/F – Abbeville,Banque Populaire du Nord,,"Description de l'entreprise Qui sommes-nous ? Banque coopérative de premier plan et acteur clé de l'économie régionale, la Banque Populaire du Nord soutient et encourage l'audace de tous ceux qui entreprennent. La Banque Populaire du Nord fait partie du 2nd plus grand groupe bancaire français (BPCE) et déploie ses 136 agences de proximité, 7 agences Entreprises dont une Grands Comptes et 2 agences Patrimoniales dans le Nord, le Pas de Calais, La Somme, l'Aisne et les Ardennes. Un projet professionnel au sein d’une Banque où le collaborateur est au centre de ses priorités vous enthousiasme ? Une promesse d’excellence dans le cadre de la relation et la satisfaction client correspond pleinement à vos valeurs ? C’est le moment de lire attentivement la description du poste qui suit ! Poste et missions Quel sera votre rôle ? Sous la responsabilité du directeur d’agence votre rôle consiste à accueillir nos clients, traiter les opérations courantes ainsi que vendre nos produits bancaires et d’assurance. Vous équipez la clientèle existante et nouvelle en proposant cartes, produits d’épargne et de prévoyance. Vous décelez les besoins et projets des clients par une communication régulière avec ceux-ci. Vous assurez certains traitements administratifs spécifiques tels que les contrôles internes ou l’alimentation du GAB. Profil et compétences requises Le portrait du conseiller commercial Banque Populaire du Nord ? Nous recherchons des profils évolutifs, capables et ayant l’envie de grandir vers des fonctions de conseiller de clientèle Particuliers. D’un tempérament nécessairement commercial, vous disposez d’un excellent sens relationnel et d’une très bonne capacité d’organisation, de rigueur et de sens du risque. Enfin vous disposez d’un niveau d’étude à minima Bac+2/+3 (BTS Banque – Licence Banque Assurance ou tout autre formation orientée commerciale et relation client). Votre énergie, votre tempérament positif et votre envie primeront sur l’expérience professionnelle. Informations complémentaires sur le poste GROUPE BPCE il y a 22 jours - Continuer pour postuler Signaler l'offre"
38,Account Executive,Oodrive,,"Qui sommes-nous ?  Oodrive, éditeur de solutions cloud de gestion de données, pionnier et leader en France : -) Notre ambition ? Devenir Leader Européen ! Et on a tout ce qu'il faut pour ça : un marché ultra porteur, la sécurité au cœur de notre métier, une réglementation en notre faveur (RGPD & co), une belle levée de fond en 2017 (65 M d'€) and last but not least...Nos TALENTS !  Dans un contexte où la collaboration à ditance se démocratise et où la sécurité des données devient de plus en plus primordiale, nous cherchons à proposer une réelle alternative européenne et luttons pour la souveraineté numérique du continent.  Pour continuer sur cette belle lancée, nous cherchons à renforcer notre Team Sales en recrutant un(e) Account Executive sur la verticale Banque/Finance/Assurance.  Vous vous demandez quel est le rôle d'un(e) Account Executive chez Oodrive ?  Vous êtes en charge de développer un portefeuille de comptes clients existant à travers des actions de prospection, de suivi et d'accompagnement. Vous intervenez auprès de clients grands comptes et d'interlocuteurs de haut niveau (C level).  Et si c’était vous, quelles seraient vos missions ?  Au sein de la Direction Commerciale organisée par verticales avec une approche multi produits, vous évoluez au sein de notre équipe BFA (Banque /Finance/Assurance) pilotée par un Sales Team Leader auquel vous reportez directement.  Responsable de la planification, de l’exécution et du développement de la stratégie commerciale en coordination avec votre N+1, vous êtes amené-e à :  Bâtir une stratégie et réaliser un mapping de comptes au sein d'organisations complexes. Construire et entretenir une relation forte avec vos clients dans une optique de fidélisation. Anticiper les besoins clients et identifier les opportunités. Conduire les négociations commerciales pour développer les ventes et reconduire les contrats existants. Développer le business en multipliant les contacts au sein des organisations clientes et en additionnant les ventes. Interagir avec de multiples interlocuteurs en interne (avant-vente, marketing, support, technique ) dans une optique collaborative. Les Plus du job ?  Vous travaillez avec un/e Technical Account Manager dédié(e) à votre équipe ce qui vous permet de comprendre notre offre produits (caractéristiques, avantages et bénéfices) et de rester informé-e sur les caractéristiques et avancées de votre marché. Vous travaillez avec un/e Business Development Representative (BDR) qui vous accompagne dans votre démarche de prospection. Vous bénéficiez de ressources internes pour appuyer l'ensemble de votre démarche (outils marketing, références clients, témoignages utilisateurs, etc). Les Plus Oodrive ?  Des bureaux en plein centre de Paris dans un super quartier qui regorge de restaus sympas et variés !#FoodLab Un environnement de travail fun et comfy : terrasse (avis aux amateurs de pétanque), roof-top, salle de jeux... Des Events réguliers entre Oodrivians et un pot tous les vendredi soir avec free drinks : -) Postulez absolument si : Vous êtes issu(e) d'une formation supérieure à dominante commerciale. Vous disposez d'une première expérience similaire idéalement au sein d'un Éditeur de logiciel. Vous maîtrisez l'usage d'un CRM (Sales Force idéalement). Vous maîtrisez les techniques de vente et de négociation idéalement sur des cycles longs. Vous avez une appétence pour les nouvelles technologies #Cloud Les petits plus qui feront une GRANDE différence : Adaptation et flexibilité ! #StartUpSpirit Orienté(e) résultat mais aussi client ! Vous maîtrisez le secteur BFA sur le bout des doigts! You are at ease in English ! Team Player : -) il y a 10 jours - Continuer pour postuler Signaler l'offre"
39,CONSEILLER CLIENTELE (H/F),CAISSE REGIONALE DU CREDIT MUTUEL ANTILLES GUYANE,,"Présentation de la société La stratégie du Crédit Mutuel Alliance Fédérale se développe selon 4 axes : BANCASSURANCE: La bancassurance propose une offre intégrée correspondant aux besoins de nos sociétaires en banque et en assurance. MUTUALISME: Notre manière d'être et d'agir repose sur le respect et la confiance. L'intérêt du sociétaire prime sur la structure. TECHNOLOGIE: Nous maîtrisons les technologies nouvelles, pour les mettre au service des sociétaires et des Caisses. BANQUE DE PROXIMITÉ Concernant le Crédit Mutuel, la relation avec le sociétaire est assurée par des Caisses autonomes, impliquées dans le tissu local. par l'utilisation des outils de banque à distance. Avec le rachat du CIC en 1998, le Groupe Crédit Mutuel Alliance Fédérale accède à un réseau international présent sur tous les continents. Sur cette base, la stratégie de développement international va notamment s'appuyer sur l'expertise du Groupe en matière de bancassurance et de flux monétiques ainsi que sur les assurances et le crédit à la consommation. Aujourd'hui le Groupe Crédit Mutuel Alliance Fédérale poursuit son internationalisation. Mission Le Crédit Mutuel Antilles-Guyane recherche, pour la Caisse du Crédit Mutuel du Crédit populaire Guyanais, un Conseiller clientèle (H/F).  Mission principale  Le Conseiller clientèle (H/F) développe, gère et fidélise un portefeuille de clients particuliers. Il/elle leur vend les produits et services de bancassurance leur permettant de faciliter leur gestion courante et dans le cadre d'une approche par univers de besoins, il/elle constitue leur équipement et leur permet de préparer, puis réaliser leurs projets. Il/elle vise la maîtrise des risques et la rentabilité de son portefeuille. Il/elle exerce des activités de guichet et/ou de maintenance des automates.  Activités / Tâches spécifiques du poste Le Conseiller clientèle (H/F):  Prépare, organise et suit son activité commerciale Prépare et conduit ses entretiens Assure le suivi de la relation Analyse les risques, anticipe et gére leur dégradation Merci d’adresser votre candidature (CV à jour et lettre de motivation) par mail à recrutementscmag@creditmutuel.fr Profil Connaissances et compétences Bonne connaissance des produits et services proposés à la clientèle. Maîtrise des outils de bureautique (Excel, Word, Powerpoint) et du système d'information du Groupe Crédit Mutuel Alliance Fédérale. Savoir-être - savoir-faire Faire preuve de réactivité et de dynamisme. Savoir communiquer et travailler en équipe. Possédez de bonnes qualités relationnelles Votre aptitude à la négociation commerciale et votre aisance relationnelle constituent les moteurs essentiels de votre réussite. Avoir le sens de l'écoute Certification(s)/Accréditation(s) Certification AMF Avantages Rémunération fixe versée sur 14 mois RTT Intéressement, participation et abondement Plan épargne entreprise Contrat de santé collectif Prévoyance Conditions bancaires et assurances préférentielles Politique parentale avantageuse  Société : CAISSE REGIONALE DU CREDIT MUTUEL ANTILLES GUYANE | Réf. : A039014 | Date de publication : 10/04/2021 Credit Mutuel Il y a plus de 30 jours - Continuer pour postuler Signaler l'offre"
40,CONSEILLER CLIENTELE (H/F),CAISSE REGIONALE CREDIT MUTUEL ILE DE FRANCE,,"Présentation de la société Deuxième banque de détail en France, le groupe Crédit Mutuel Alliance Fédérale comprend le réseau du Crédit Mutuel Alliance Fédérale et l’ensemble de ses filiales, dont le CIC. Avec ses principales filiales, CIC (acquis en 1998) et Targo Bank (acquis en 2008), le Groupe Crédit Mutuel Alliance Fédérale est au service de 17,4 millions de clients dans 4 459 points de vente.Dans cet ensemble, les 1 932 Caisses et points de vente du Crédit Mutuel servaient 6,2 millions de clients, dont 4 millions de sociétaires, au 31 décembre 2009.Comme il l’a toujours été, le Crédit Mutuel reste fidèle aux lignes de force qu’il s’est fixé avec succès : la banque mutualiste, la banque de proximité, la banque technologique et la bancassurance. Le Crédit Mutuel est une banque mutualiste : le réseau des Caisses locales constitue le maillon essentiel de l’organisation du Crédit Mutuel. Il assure un vrai service de proximité à nos clients et permet une grande réactivité. Mission Mission principale Le Conseiller bancaire/Conseiller clientèle développe, gère et fidélise un portefeuille de clients particuliers Il leur vend les produits et services de bancassurance leur permettant de faciliter leur gestion courante et dans le cadre d'une approche par univers de besoins, il constitue leur équipement et leur permet de préparer, puis réaliser leurs projets. Il vise la maîtrise des risques et la rentabilité de son portefeuille. Il exerce des activités de guichet et/ou de maintenance des automates. Activités / Tâches spécifiques du poste Le Conseiller bancaire/Conseiller clientèle :  Prépare, organise et suit son activité commerciale Prépare et conduit ses entretiens Assure le suivi de la relation Analyse les risques, anticipe et gére leur dégradation Profil Connaissances et compétences Bonne connaissance des produits et services proposés à la clientèle. Maîtrise des outils de bureautique (Excel, Word, Powerpoint) et du système d'information du Groupe Crédit Mutuel Alliance Fédérale. Savoir-être - savoir-faire Faire preuve de réactivité et de dynamisme. Savoir communiquer et travailler en équipe. Possédez de bonnes qualités relationnelles Votre aptitude à la négociation commerciale et votre aisance relationnelle constituent les moteurs essentiels de votre réussite. Avoir le sens de l'écoute Certification(s)/Accréditation(s) Certification AMF Avantages Rémunération fixe versée sur 13 mois RTT Intéressement, participation et abondement Plan épargne entreprise et PERCO Contrat de santé collectif Prévoyance Retraite supplémentaire prise en charge à 100% par l’employeur Conditions bancaires et assurances préférentielles Politique parentale avantageuse CIC FR il y a 28 jours - Continuer pour postuler Signaler l'offre"
41,GESTIONNAIRE DE CLIENTELE H/F – Agence de Alès Evêché – CDI,Caisse d'Epargne Languedoc Roussillon,,"Description de l'entreprise La Caisse d’Epargne Languedoc Roussillon, acteur majeur sur son territoire, couvre tous les métiers de la banque commerciale. Banque historique des particuliers, c'est aussi la banque des professionnels et des décideurs en région. A ce titre elle accompagne l’ensemble des acteurs qui participent au développement local et régional : Particuliers, Entreprises, Organismes de l’économie sociale et du logement social, Collectivités et institutionnels locaux et Professionnels de l’immobilier. Avec près de 1.1 million de clients, représentant environ 40% de la population du territoire, la Caisse d’Epargne Languedoc Roussillon dispose d’un réseau de 184 agences, et 4 centres d’affaires. Banque de proximité et Banque digitale, elle accompagne au quotidien les projets innovants et créateurs de richesses en octroyant 2 milliards de nouveaux crédits aux ménages, aux professionnels, aux entreprises et aux collectivités locales. Très attachée à l'accompagnement de l'ensemble de ses collaborateurs La Caisse d’Epargne Languedoc Roussillon les accompagne dans leur projet professionnel tout au long de leur parcours de carrière. Poste et missions La Caisse d’Epargne Languedoc Roussillon recherche un Gestionnaire de Clientèle Particuliers H/F en CDI pour son agence de Alès Evêché. Au sein d’une agence bancaire, vous êtes l’interlocuteur privilégié des particuliers pour les accompagner dans leurs projets. A ce titre, vous disposez d’un portefeuille de 700 clients en moyenne que vous devez développer, gérer et fidéliser ! Vous êtes le garant de la satisfaction de vos clients dans un environnement fortement concurrentiel. Pour mener à bien ces missions : Vous assurez quotidiennement le suivi et la fidélisation de votre portefeuille clients et leur proposez les produits correspondant à leurs besoins. Vous déployez toutes techniques de prospection en vue de développer votre portefeuille et nouer des relations commerciales durables avec de nouveaux clients. Vous qualifiez les besoins de vos clients et/ou prospects et les orientez si nécessaire vers un Gestionnaire de Clientèle Spécialisé (Gestionnaire de Clientèle Professionnels ou Gestionnaire de Clientèle Patrimoniale). Vous maitrisez parfaitement l’offre bancaire destinée aux particuliers. Vous réalisez des ventes adaptées aux attentes de vos clients/prospects et contribuez ainsi aux résultats collectifs de l’agence. Vous pérennisez la relation client dans le respect des normes et des procédures de risques. Profil et compétences requises De formation Bac+3 minimum et/ou expérience confirmée dans le secteur Banque Assurances, vous maitrisez parfaitement les techniques de vente/prospection et avez un sens important du service client. Animé d’un fort esprit d’équipe, votre talent et votre dynamisme commercial vous permettront de participer activement à la réalisation des objectifs de développement de l’agence. Vous maitrisez les bases financières en lien avec l’environnement bancaire ainsi que celles de gestion et développement d’un portefeuille de clients particuliers. Dynamique et responsable, vous aimez atteindre les objectifs fixés et tenez les engagements pris avec vos clients. En fonction de vos souhaits, des besoins de l’Entreprise et de vos compétences, vous aurez la possibilité d’évoluer professionnellement et relever les challenges que la CELR pourra vous proposer ! Informations complémentaires sur le poste GROUPE BPCE il y a 22 jours - Continuer pour postuler Signaler l'offre"
