,title,company,salary,summary
42,Référent collecte et relations partenaires (H/F),PROFIDEO,,"Dans le cadre d’une création de poste nous vous confierons deux activités principales : 1) Référent collecte Nous avons développé une base de données alimentant l’ensemble de nos solutions digitales, afin de garantir la satisfaction de nos clients, il est primordial que cette dernière soit mise à jour. Au sein du pôle collecte, nouvellement créé, vous serez le garant du contenu de notre base de données. Vous travaillerez principalement avec les 15 experts du pôle métier afin de : - faire de la veille et de la collecte produit sur le marché banque/assurance, - rechercher sur demande un produit spécifique, - tenir à jour notre annuaire de contacts, - animer un réseau de partenaires, - tenir à jour notre référentiel de collecte et le faire évoluer en continue. 2) Chargé des relations partenaires Créé en 1984, Les Dossiers de l’Épargne est un guide devenu une référence en tant que comparateur d’offres d’assurances. Avec à ce jour 17 analyses par an, chaque numéro décerne des « labels d’excellence » aux contrats d'assurance, d'épargne et de banque les mieux notés. (https://guides.lesdossiers.com/site/) Dans ce cadre, voici les missions que vous réaliserez : - tenir à jour le planning de réalisation, - inviter nos partenaires à la participation aux guides LDE (sans oublier de les relancer), - garantir la bonne collecte des produits et tarifs du marché, - réaliser les reporting qui vous seront demandés, - Gérer une fois par semaine les commandes de guides et leur expédition. Ce poste étant nouvellement créé, d’autres missions tout aussi intéressantes vous seront confiées comme l’amélioration de notre site boutique en ligne, nos interfaces de collecte, etc. Le profil : Vous avez une formation de type Bac+2 à Bac +3 dans l’administratif, la gestion de projet, l’assurance. Idéalement une première expérience dans le milieu Banque ou Assurance. Nous recherchons une personne autonome, dynamique, ayant un sens commercial et surtout sachant utiliser Excel (tableaux croisés dynamiques, formules de type rechercheV / Importrange etc..). Date limite de candidature : 30/04/2021 Date de début prévue : 06/04/2021 Job Types: Full-time, Permanent COVID-19 Precaution(s): Remote interview process Il y a plus de 30 jours Signaler l'offre"
43,Stage - Relation Client - Agence de Chambéry Colonne-(H/F),Société Générale,,"Vos missions au quotidien Devenez un acteur de choix pour Société Générale et nos clients A ce titre et en collaboration avec votre maître de stage qui assurera votre formation, vous participez aux missions suivantes : Appui à l’équipe dans la gestion de l’agence (téléphonie, accueil de la clientèle, tâche administrative) Promotion du digital Aide à l’autonomie des clients Aide à la détection des besoins auprès des clients. Et si c’était vous ? Votre profil nous intéresse - Vous êtes étudiant(e) en bac +2/+3 avec une spécialisation en banque / assurance. Compétences à acquérir ou à développer : Rigueur dans le travail Compétences comportementales vis à vis de la clientèle Montée en compétence sur les produits bancaires de base Gestion des appels entrants et sortants Posture d’accueil auprès de la clientèle Connaissances des produits digitaux Plus qu’un poste, un tremplin Et si c'était vous ? Pour soumettre votre candidature, cliquez sur le bouton « Postuler maintenant » ci-dessous. Si votre candidature est retenue, vous serez contacté(e) pour un entretien de motivation.  Stage de 4 à 6 mois basé à l'agence de Chambéry Colonne Gratification selon grilles Société Générale. Pourquoi nous choisir ? Prenez votre place dans l'équipe - L’environnement de la banque est en pleine mutation : contraintes réglementaires de plus en plus fortes, opportunités technologiques de plus en plus rapides… Dans ce cadre, la connaissance fine de notre clientèle ainsi que la bonne adéquation de notre offre sont indispensables.  Votre stage se déroulera au sein de l'équipe de Chambéry Colonne - agence composée de 15 collaborateurs dont 3 conseillers de clientèle de professionnels et 2 conseillers en Gestion de Patrimoine -  Les équipes Société Générale sont présentes aux côtés de 8 millions de clients particuliers et 466 000 clients professionnels, associations et entreprises pour les accompagner, dans la durée, avec des solutions adaptées à leurs besoins. Nous sommes un employeur garantissant l'égalité des chances et nous sommes fiers de faire de la diversité une force pour notre entreprise. Le groupe s’engage à reconnaître et à promouvoir tous les talents, quels que soient leurs croyances, âge, handicap, parentalité, origine ethnique, nationalité, identité sexuelle ou de genre, orientation sexuelle, appartenance à une organisation politique, religieuse, syndicale ou à une minorité, ou toute autre caractéristique qui pourrait faire l’objet d’une discrimination. Référence: 2100090Y Entité: Banque de détail France Date de début: 15/07/2021 Date de publication: 24/03/2021 Societe Generale il y a 29 jours - Continuer pour postuler Signaler l'offre"
44,Gestionnaire de Clientèle H/F – BASSINS A FLOTS 33,Caisse d'Epargne Aquitaine Poitou Charentes,,"Description de l'entreprise Vous souhaitez intégrer un Groupe en pleine transformation digitale ? Pour vous aussi, l’expertise métier au service de la satisfaction clients a du sens ? Alors rejoignez la Caisse d’Épargne Aquitaine Poitou Charentes, banque régionale coopérative, et participez à son développement commercial, technologique et humain. Vous intégrerez ainsi une entreprise qui met au cœur de sa stratégie la formation de ses collaborateurs, et qui a pour volonté de les accompagner dans le développement de leurs compétences. Pour accompagner son développement commercial, technologique et humain, la CEAPC recherche un Gestionnaire de Clientèle (H/F) en CDI pour son agence de Bassins à flots. Poste et missions En tant que Gestionnaire de Clientèle, nous vous confierons un portefeuille de 550 clients. Votre objectif sera de conseiller au mieux vos clients et de développer ce portefeuille. Votre valeur ajoutée portera sur : La gestion et le développement de votre portefeuille à travers la gestion du flux physique et téléphonique, le traitement de vos opportunités commerciales. La création d’un climat de confiance avec vos clients, en vous basant sur les valeurs de la Caisse d’Épargne : proximité, réactivité et expertise. L’expertise apportée à vos clients notamment sur des produits complexes (assurance vie, prêt immobilier,…) La détection de leurs besoins et l’orientation vers une solution adaptée, lors de rendez-vous en face à face et à distance Votre proactivité, en optimisant les bases de données, alertes et contacts directs des clients, Votre agilité à utiliser les différents canaux de distribution (téléphone, mail, applications smartphone,…) Votre capacité à maximiser la satisfaction de vos clients, dans le respect du contrat de relation instauré Profil et compétences requises Si vous disposez d’une première expérience significative dans le secteur de la vente ou si vous êtes diplômé (Bac+3 minimum) avec une spécialisation Banque/Finance ou Vente/Commerce, nous souhaitons vous rencontrer. Votre forte appétence commerciale, votre sens de l’organisation et de l’analyse associés à vos qualités relationnelles vous permettront de réussir dans cet emploi. Impliqué (e) auprès de vos collègues, vous évoluez au sein d'une équipe de 4 collaborateurs. De plus, la prise d’initiatives et votre envie de vous dépasser seront des atouts pour la réussite de votre projet professionnel et pour vous permettre d’évoluer rapidement au sein de la Caisse d’Épargne. Chacun de nos nouveaux collaborateurs bénéficient d'une solide formation théorique et sur le terrain. Par la suite, nos collaborateurs sont suivis par un Conseiller en Ressources Humaines attitré qui définit avec lui sa trajectoire professionnelle.  Informations complémentaires sur le poste Dans le cadre du process de recrutement externe, un entretien vidéo EASY RECRUE ainsi qu'un questionnaire de personnalité ASSESSFIRST pourront venir compléter votre candidature. Contact RH : Lise CHOPIN-TEXIER GROUPE BPCE il y a 10 jours - Continuer pour postuler Signaler l'offre"
45,CHARGE DE CLIENTELE PARTICULIERS H/F,CCM LAXOU-VILLERS,,"Présentation de la société La stratégie du Crédit Mutuel Alliance Fédérale se développe selon 4 axes : BANCASSURANCE: La bancassurance propose une offre intégrée correspondant aux besoins de nos sociétaires en banque et en assurance. MUTUALISME: Notre manière d'être et d'agir repose sur le respect et la confiance. L'intérêt du sociétaire prime sur la structure. TECHNOLOGIE: Nous maîtrisons les technologies nouvelles, pour les mettre au service des sociétaires et des Caisses. BANQUE DE PROXIMITÉ Concernant le Crédit Mutuel, la relation avec le sociétaire est assurée par des Caisses autonomes, impliquées dans le tissu local. par l'utilisation des outils de banque à distance. Avec le rachat du CIC en 1998, le Groupe Crédit Mutuel Alliance Fédérale accède à un réseau international présent sur tous les continents. Sur cette base, la stratégie de développement international va notamment s'appuyer sur l'expertise du Groupe en matière de bancassurance et de flux monétiques ainsi que sur les assurances et le crédit à la consommation. Aujourd'hui le Groupe Crédit Mutuel Alliance Fédérale poursuit son internationalisation. Mission Mission principale Le Conseiller de Clientèle / Chargé de Clientèle Particuliers développe, gère et fidélise un portefeuille de clients particuliers « coeur de cible » Dans le cadre d' une approche par univers de besoins, il leur vend les produits et services bancassurances optimisant leur équipement et leur permettant de réaliser leurs projets. Il vise la maîtrise des risques et la rentabilité de son portefeuille. Par des actions de recommandation et de prospection, il assure l'enrichissement et le renouvellement de son portefeuille et contribue au développement commercial de son agence. Dans certaines organisations, il exerce des activités de guichet et/ou de maintenance des automates. Activités / Tâches spécifiques du poste Le Conseiller de Clientèle / Chargé de Clientèle Particuliers : Prépare, organise et suit son activité commerciale  Prépare et conduit ses entretiens : Mobilise les spécialistes lorsque les besoins des clients le nécessitent.  Conquiert de nouveaux clients : Sollicite des recommandations ; développe la prescription. Conduit les actions de prospection (hors recommandation).  Assure le suivi de la relation  Analyse les risques, anticipe et gére leur dégradation Profil Connaissances et compétences Expérience confirmée dans le métier de Conseiller Bancaire/Conseiller Clientèle - Compétences commerciales démontrées Maîtrise de la gestion des risques (risques naissants, suivi débiteurs, pré-contentieux...) Capable de procéder à des analyses de rentabilité et de risques Savoir mener et concrétiser un entretien de vente Bonne culture économique (notamment du tissu économique local) Savoir-être - savoir-faire Bonne expression écrite et orale Aisance relationnelle, écoute Rigueur, organisation et autonomie Disponibilité, réactivité et dynamisme motivation commerciale, force de conviction, capacité d'adaptation, empathie Savoir communiquer et travailler en équipe Savoir faire preuve de pédagogie. Certification(s)/Accréditation(s) AMF indispensable. Avantages Rémunération fixe versée sur 13 mois RTT Intéressement, participation et abondement Plan épargne entreprise et PERCO Contrat de santé collectif Prévoyance Retraite supplémentaire prise en charge à 100% par l’employeur Conditions bancaires et assurances préférentielles Politique parentale avantageuse  Société : CCM LAXOU-VILLERS | Réf. : A038628 | Date de publication : 11/04/2021 Credit Mutuel Il y a plus de 30 jours - Continuer pour postuler Signaler l'offre"
46,CHARGE D AFFAIRES PROFESSIONNELS (H/F),CAISSE FEDERALE DE CREDIT MUTUEL,,Pas de description
47,GESTIONNAIRE DE DOSSIERS DE SURENDETTEMENT - H/F,La Banque de France,,"Présentation de la Direction générale  La Banque de France est aujourd’hui le pilier français de l’Eurosystème, système fédéral qui regroupe la Banque centrale européenne et les banques centrales nationales. Ses trois grandes missions sont la stratégie monétaire, la stabilité financière et les services à l’économie. Les services à l’économie sont essentiellement assurés par le réseau de la Banque de France. Ce sont des services concrets rendus aux ménages les plus fragiles avec, en 2020, le traitement de 124 000 dossiers de surendettement et la désignation d’établissements bancaires dans le cadre du droit au compte. Ce sont aussi des services rendus aux entreprises avec la cotation, la médiation du crédit et l’accompagnement des TPE ainsi que la réalisation d’enquêtes de conjoncture nationales et régionales toujours très attendues par les chefs d’entreprise et les médias.  Présentation du Service  La succursale d’Orléans est composée de 73 personnes. Elle opère sur l'ensemble des métiers du réseau de la Banque de France (traitement fiduciaire, service des Particuliers, service des Entreprises). Au sein de l'unité d’Orléans, le service des Particuliers, composé de 15 collaborateurs, gère le traitement de 3 000 dossiers de surendettement pour le compte des départements du Loiret, de l’Eure-et-Loir et du Cher. Il assure également le droit d'accès du public aux fichiers d'incident, le traitement des demandes de droit au compte, l'information sur les problématiques de droit bancaire, et participe à l'éducation financière du public.  Descriptif de mission  Vous assurerez l'instruction de dossiers de surendettement déposés par des particuliers : vérification de la complétude des dossiers, proposition d'une orientation à la Commission de Surendettement et traitement du dossier jusqu'au terme de son instruction, établissement du relationnel avec les débiteurs et les créanciers.  Profil recherché  Formation recherchée : Bac +2 : BTS assistant service social, BTS banque/assurance, DUT carrières juridiques Bac +3 : dominante sociale, Diplôme d'état en économie sociale et familiale (DECESF), Licence domaine juridique (droit, etc.)  Compétences : Capacité et motivation à acquérir de nouvelles compétences, notions juridiques (droit civil et de la consommation), Aisance dans les outils bureautiques.  Qualités : Rigueur et fiabilité Autonomie Discrétion Aisance relationnelle  La Banque de France est une institution socialement responsable, attachée à la diversité de ses personnels. Des aménagements de poste peuvent être organisés pour tenir compte des handicaps des personnes recrutées. Il y a plus de 30 jours - Continuer pour postuler Signaler l'offre"
48,Collaborateur (H/F),CABINET ALLIANZ,1 675 € par mois,"Collaborateur d'agence H/F Description de l'entreprise Agence d'assurance Description du poste Collaborateur H/F dans une agence d'assurance familiale. Temps de travail réparti entre la gestion et le commercial en agence. Niveau BAC + 2 minimum ou experience caractérisée en banque/assurance Statut : Cadre Date de début prévue : 01/05/2021 Mots-clés similaires: assurance, alternance Type d'emploi : Temps plein, CDI Salaire : à partir de 1 675,00€ par mois Horaires : Du Lundi au Vendredi Repos le Week-end Travail en journée Rémunération supplémentaire : Primes Mesures COVID-19: mesures obligatoires en vigueur Télétravail: Non il y a 9 jours Signaler l'offre"
49,"Conseiller financier - Vincennes, IDF Est F/H",UFIFRANCE GESTION,,"Descriptif du poste: Vous êtes salarié(e) en CDI. Vous bénéficiez d’une formation adaptée à votre expérience et à l’habilitation/aux habilitations que vous détenez. Au sein de notre école de formation patrimoniale, sans équivalent sur le marché, vous abordez l’ensemble des aspects techniques et commerciaux liés au conseil en gestion de patrimoine des particuliers, des professionnels et entreprises. En clientèle, durant votre formation initiale, vous êtes accompagné(e) de votre manager qui vous enseigne nos techniques commerciales. Vous déterminez avec lui une zone géographique sur laquelle évoluer. Votre poste est itinérant. Vous disposez d’une gamme complète de solutions d’investissement, construite en architecture ouverte et recouvrant l’ensemble des secteurs financiers et immobiliers. Elle vous permet de conseiller et d’accompagner vos clients, dans la réalisation de tous leurs objectifs patrimoniaux hors immobilier : financiers, civils, fiscaux et d’épargne. Au quotidien, vous êtes épaulé(e) par votre manager et une équipe d’experts, tout en conservant autonomie et responsabilités. Tout au long de votre carrière, vous bénéficiez d’une formation continue et selon votre ambition, vous pourrez renforcer vos compétences au sein de votre métier, évoluer vers une autre filière ou encore vous orienter vers le management. Vous bénéficiez d’une rémunération différenciante et déplafonnée. Elle se compose : d'un fixe représentant environ 60% de votre rémunération, de primes variables représentant environ 40% de votre rémunération, et, au-delà de l’atteinte de vos objectifs, d’une commission de performance déplafonnée. Nous vous proposons également de nombreux avantages et outils, notamment : un véhicule de société avec une carte essence ou des indemnités kilométriques, des titres restaurant, l’accès à un dispositif d’épargne salariale, une épargne retraite, ... Nos + : Une autonomie dans votre activité avec un statut salarié Une rémunération déplafonnée Une école de formation unique sur le marché De nombreuses possibilités d’évolution de carrière et de mobilité partout en France La plus large gamme de solutions d’investissements du marché, construite en architecture ouverte Vos missions : Développer et fidéliser votre portefeuille de clients particuliers. Accompagner vos clients particuliers : Réaliser des analyses patrimoniales Préconiser une stratégie d’investissement répondant aux attentes et objectifs de vos clients, tout en respectant leur profil de risque (préparer leur retraite, optimiser leur fiscalité, protéger leur conjoint(e), transmettre leur patrimoine, anticiper des études de leur(s) enfant(s), réaliser un projet personnel, etc.). Assurer un suivi régulier et individuel de l’ensemble de votre clientèle, en instaurant une relation de confiance.  Profil recherché: Qualifications Diplômé(e) au minimum d’un BAC+2, vous êtes un(e) professionnel(le) des services financiers (banque, assurance, financement, ...). Dans ce domaine, vous justifiez d’une expérience de 5 ans minimum. Vous avez construit une relation forte et privilégiée avec votre réseau de particuliers dans votre région. Vous détenez une habilitation IAS et/ou IOBSP vous permettant de commercialiser des contrats d'assurance ou de proposer des offres de crédit immobilier. Vous êtes un(e) commercial(e) dans l’âme. Vous avez une grande aisance relationnelle. Votre exigence, votre ténacité et votre autonomie vous permettent d’atteindre vos objectifs. Vous partagez nos valeurs de proximité, d’éthique et d'écoute auprès de nos clients. Votre motivation sans faille, votre enthousiasme et votre régularité seront les clefs de votre réussite au sein de l'UFF. Le poste étant itinérant, des déplacements sont à prévoir. A bientôt dans l’une de nos agences !  Entreprise: A l’origine du métier de conseiller en gestion de patrimoine en France, l’UFF est leader sur son marché depuis plus de 50 ans. Détenue à 75% par Aviva Vie, elle est cotée depuis 1987 à la Bourse de Paris. Elle est forte d’un portefeuille de plus de 200 000 clients (particuliers, professionnels, entreprises), de 11,4 milliards d’euros d’actifs administrés (au 31.12.2018) et de 1400 collaborateurs(trices), dont plus de 1.000 dédiés(es) au conseil et présents(es) partout en France. Elle commercialise l'ensemble des solutions patrimoniales, sélectionnées en architecture ouverte. Pour conserver sa position de leader, innover et poursuivre sa croissance, l’UFF recrute 250 conseillers(ères). Vous souhaitez vous aussi vous investir dans ce challenge ? Rejoignez-nous ! Signataire de la Charte de la diversité, l’UFF s'engage à favoriser le pluralisme et rechercher la diversité au travers des recrutements et de sa gestion des carrières Apec.fr Aujourd'hui - Continuer pour postuler Signaler l'offre"
50,CHARGE / CHARGEE D AFFAIRES PROFESSIONNELS (H/F),CAISSE REGIONALE DE CREDIT MUTUEL DU CENTRE,,"Présentation de la société La stratégie du Crédit Mutuel Alliance Fédérale se développe selon 4 axes : BANCASSURANCE: La bancassurance propose une offre intégrée correspondant aux besoins de nos sociétaires en banque et en assurance. MUTUALISME: Notre manière d'être et d'agir repose sur le respect et la confiance. L'intérêt du sociétaire prime sur la structure. TECHNOLOGIE: Nous maîtrisons les technologies nouvelles, pour les mettre au service des sociétaires et des Caisses. BANQUE DE PROXIMITÉ Concernant le Crédit Mutuel, la relation avec le sociétaire est assurée par des Caisses autonomes, impliquées dans le tissu local. par l'utilisation des outils de banque à distance. Avec le rachat du CIC en 1998, le Groupe Crédit Mutuel Alliance Fédérale accède à un réseau international présent sur tous les continents. Sur cette base, la stratégie de développement international va notamment s'appuyer sur l'expertise du Groupe en matière de bancassurance et de flux monétiques ainsi que sur les assurances et le crédit à la consommation. Aujourd'hui le Groupe Crédit Mutuel Alliance Fédérale poursuit son internationalisation. Mission Mission principale Vous développez, gérez et fidélisez un portefeuille de clients « professionnels » (entrepreneurs individuels et, en fonction de leurs effectifs, artisans commerçants, professions libérales, Très Petites Entreprises).  Vous intervenez sur l'ensemble de la relation commerciale avec les clients de votre portefeuille et gérez à la fois la dimension « privée » et la dimension « professionnelle ». Vous commercialisez, dans le cadre d'une approche globale, les produits et services afin d'optimiser la gestion courante des clients et accompagnez ces derniers dans la réalisation de leurs projets, en mobilisant des spécialistes chaque fois que nécessaire (ingénierie patrimoniale et sociale, crédit bail, flux et assurances). Vous visez la maîtrise des risques et la rentabilité du portefeuille clients. Par des actions de prospection et d'entrée en relation, vous enrichissez le portefeuille et contribuez au développement commercial de votre agence. Activités / Tâches spécifiques du poste Le chargé d'affaires professionnels / La chargée d'affaires professionnels :  Prépare, organise et suit son activité commerciale Prépare et conduit ses entretiens Prospecte de nouveaux clients Assure le suivi de la relation Analyse les risques, anticipe et gère leur dégradation Profil Connaissances et compétences Bonne connaissance des produits et services proposées à la clientèle. Bonne culture économique et financière. Maîtrise des outils de bureautique (Excel, Word, Powerpoint) et du système d'information du Groupe Crédit Mutuel Alliance Fédérale. Bonne culture économique et financière. Savoir-être - savoir-faire Vous possédez de bonnes qualités relationnelles Votre aptitude à la négociation commerciale et votre aisance relationnelle constituent les moteurs essentiels de votre réussite. Vous disposez de bonnes capacités d'analyse et de synthèse. Vous êtes une personne rigoureuse, organisée et fiable. Vous êtes capable d'autonomie. Vous faites preuve de réactivité et de dynamisme. Vous savez communiquer et travailler en équipe. Certification(s)/Accréditation(s) Certification AMF Avantages Rémunération fixe versée sur 13 mois RTT Intéressement, participation et abondement Plan épargne entreprise et PERCO Contrat de santé collectif Prévoyance Retraite supplémentaire prise en charge à 100% par l’employeur Conditions bancaires et assurances préférentielles Politique parentale avantageuse  Société : CAISSE REGIONALE DE CREDIT MUTUEL DU CENTRE | Agence : CAISSE DE CREDIT MUTUEL DE TOURS GRAMMONT | Réf. : A039574 | Date de publication : 08/04/2021 Credit Mutuel il y a 14 jours - Continuer pour postuler Signaler l'offre"
