,title,company,salary,summary
34,Alternant Commerce H/F,VISIAN,,"Description de l'entreprise  Visian est une société de conseil et de développement spécialisée dans le passage à l’échelle des projets innovants. Visian a pour mission de détecter, accélérer et industrialiser les nouveaux usages du digital, de l'IoT et de la data. Nous intervenons en amont sur des missions de conseil et de Design Thinking, de pilotage de projets, de mise en œuvre technique (MVP, développement plateforme IoT, Data) et d’intégration de solutions innovantes. Nos principaux secteurs d’activités : énergie, industrie, bailleurs sociaux, digital workplace, banque assurance.  Description du poste  Nos clients ont régulièrement besoin de ressources pour faire avancer leurs projets. Votre travail sera donc de nous accompagner dans la sélection des meilleurs profils IT du marché (CDI ou Indépendants) afin d'aider nos clients à constituer leurs équipes. Mission : Accompagner l'équipe commerciale dans le recrutement d'indépendants/Freelance. Participer au cycle de vie du recrutement du sourcing à la proposition de contrat Gestions des comptes clients et prospection. Objectifs : Rédiger et poster quotidiennement des offres de missions Réaliser quotidiennement des entretiens téléphoniques Réalisation d'entretiens clients et aide à la signature de candidats Suivi prestataires en mission  Qualifications Vous préparez un diplôme de niveau Bac+4/5 commercial , vous avez un tempérament commercial et souhaitez développer vos qualités humaines, Vous souhaitez connaître les métiers du recrutement au sein d’une entreprise en pleine évolution, Vous êtes technophile et souhaitez monter en compétence dans le digital et l’IT. Rythme d’alternance recherché : 4 jours d’entreprise / 1 jour école OU 3 semaines entreprise / 1 semaine école  Informations supplémentaires Persévérance et abnégation Empathie et sens du contact Respect des processus de recrutement et contribution à leur amélioration Dynamisme et esprit d’équipe Technophile il y a 12 jours - Continuer pour postuler Signaler l'offre"
35,Animateur de vente du service financier et assurance (H/F),Carrefour,,"Filiale de Carrefour, Carrefour Banque et Assurance c’est 35 ans d’innovation et d’expertise !  Depuis sa création, Carrefour Banque et Assurance innove pour proposer à ses client(e)s des solutions adaptées à leur situation, leurs besoins, leur budget à travers une large gamme de produits allant du crédit, aux cartes de paiement, aux produits d’épargne et d’assurance, assortis de nombreux services et avantages associés.  Carrefour Banque et Assurance c'est aussi : plus de 1 700 collaborateur(trice)s orientés client(e)s. une approche multicanal pour plus de proximité avec nos client(e)s à travers plus de 200 agences partout en France, une plate-forme téléphonique, un site Internet et des applications mobiles. des partenariats avec des acteur(trice)s reconnu(e)s qui accompagnent la diversification des activités. Carrefour recherche pour le service Carrefour Banque un(e) :  Animateur / Animatrice de vente du service financier et assurance  Vous êtes titulaire d’un Bac, idéalement dans le secteur bancaire et/ou assurances et vous souhaitez pouvoir mettre en application vos connaissances et vos compétences au sein d’une société qui vous offre de vraies perspectives de carrières.  Rattaché(e) au manager de l’agence, vous aurez comme principales missions :  Accueillir nos client(e)s et nos prospects et procéder à la découverte de leurs besoins. Proposer nos produits financiers et nos contrats d’assurances, les garanties et les services adaptés aux besoins des client(e)s. Développer notre clientèle grâce à vos actions de prospection. Coordonner l’activité de l’équipe avec votre responsable hiérarchique. Participer et suivre quotidiennement la réalisation des objectifs et proposer des plans d’action pour les atteindre.  Si comme nous :  Vous êtes commerçant(e) dans l’âme Vous avez l’esprit conquérant(e) Vous avez le sens des responsabilités Vous aimez relever de nouveaux défis  Les avantages Carrefour Banque :  Un salaire fixe sur 13 mensualités Une rémunération variable, mensuelle non plafonnée Une participation Groupe Un intéressement entreprise Un plan d’épargne salariale Des réductions dans la plupart des enseignes commerciales du Groupe Carrefour Une prévoyance santé maladie chirurgie  Rejoindre Carrefour Banque c’est faire le choix d’une société qui vous offre de réelles perspectives d’évolution ! il y a 8 jours - Continuer pour postuler Signaler l'offre"
36,Office Manager F/H,SERVI,,"Descriptif du poste: Office Manager H/F LIEU : Montrouge ( 92120) CDI SALAIRE : de 32000 à 36000 euros/an  Le groupe Servi est une agence de création d’uniformes de luxe dédiée principalement à l’industrie de l’hôtellerie et de la restauration. VOTRE MISSION  GESTION ADMINISTRATIVE .Gestion administrative des dossiers. .Gestion du courrier et des mails ou compte rendu et réponses si besoin. .Gestion des appels téléphoniques. .Gestion des appels d’offre en liaison avec les consultants.  GESTION DU PERSONNEL .Suivi des congés , absences , arrêts de travail etc… .Constitution du dossier individuel du salarié. .Envoi des éléments de paye au cabinet comptable.  GESTION COMPTABLE .Support lors des inventaires. .Contrôle des marchandises, bons de livraison, factures. .Traitement des notes de frais. .Règlements fournisseurs. .Etablissement , envoi et recouvrement des factures. .Gestion des rapprochements bancaires et pointage. .Saisie comptable journalière et pointage des comptes. . Relations avec le cabinet comptable  Profil recherché: PROFIL RECHERCHE Si vous êtes autonome, organisé( e ), dynamique et si vous avez l’esprit d’initiative, ce poste est pour vous ! De formation supérieure (Bac+2/+4), vous possédez une expérience significative sur ce type de fonction, au sein d’une TPE/PME, de préférences dans les services. Vous maîtrisez EXCEL et le pack office. Vous aimez le travail d’équipe et souhaitez rejoindre une société dynamique, à taille humaine (environ 10 personnes), avec une très bonne ambiance de travail, où convivialité et professionnalisme vont de pair. Vous pourrez travailler en binôme avec la responsable sortante durant quelques mois.  Entreprise: Nous sommes une agence de création d’uniformes Depuis plus de 15 ans notre périmètre de compétence est principalement axé vers le secteur de l’hôtellerie de luxe, de l’évènementiel, du retail, des fédérations sportives, des transports, de la sécurité, des banques et assurances, Notre rôle est d’accompagner les entreprises dans l’intégralité du « process » de création de leur identité visuelle textile et ainsi transmettre une véritable valeur ajoutée pour les salariés et clients. Les vêtements d’image devenant ainsi une véritable plus value pour l’entreprise ainsi qu’un élément de communication à part entière. Apec.fr il y a 1 jour - Continuer pour postuler Signaler l'offre"
37,Conseiller de Clientèle Centre de Relation Client H/F - Cler...,Groupe BPCE,,"Description de l'entreprise Vous souhaitez travailler au sein d'une banque performante, engagée, et ancrée sur son territoire ? La Banque Populaire Auvergne Rhône Alpes, Banque Régionale et Coopérative, est un acteur majeur sur son territoire. Appartenant au 2ème groupe bancaire français, elle a su construire son développement en mettant au cœur de la relation client ses valeurs de proximité, de réactivité et d’innovation. Elle favorise l’intégration des jeunes et des profils plus expérimentés. Elle prouve au quotidien son dynamisme et son esprit d’innovation en accompagnant les projets des clients Particuliers Professionnels, Entreprises ou Agriculteurs. Poste et missions Au sein de votre équipe de choc composée de 10 collaborateurs, vous travaillez en synergie avec notre réseau d’agences, pour garantir la satisfaction et la fidélisation des clients. Vous gérez la relation à distance au quotidien par le traitement des appels entrants et sortants, mais également la communication par mail. A ce titre, vous prenez en charge la gestion des opérations courantes mais également la détection d’opportunités commerciales avec prise de RDV ou vente directe d’une gamme élargie de produits et services : crédit à la consommation, assurances, épargne, moyens de paiement, ... Dès votre arrivée, vous bénéficiez d’un accompagnement et d’un coaching de proximité. Vous suivrez le cursus de formation dédié aux Conseillers de Clientèle, afin de découvrir nos outils, nos produits, notre politique commerciale et les différentes formations réglementaires. Après 24 mois d’expérience réussie sur ce poste, vous pourrez évoluer sur le poste de Conseiller de Clientèle Particuliers au sein de nos agences. Profil et compétences requises Le challenge ne vous fait pas peur ? Le digital n’a aucun secret pour vous ? Si en plus vous êtes diplômé(e) à minima d’un Bac+2 et que vous justifiez d’une expérience commerciale réussie, n’hésitez plus, envoyez-nous votre candidature ! Intégrer la Banque Populaire Auvergne Rhône Alpes, c’est faire partie d’un groupe qui donnera un sens à votre parcours professionnel et les moyens de vos ambitions. Révélez vos talents, prenez le cap BPAURA ! Job Reference: BPAURA02093 il y a 2 jours - Continuer pour postuler Signaler l'offre"
38,CHARGE DE CLIENTELE PARTICULIERS H/F,CCM PONTARLIER,,"Présentation de la société La stratégie du Crédit Mutuel Alliance Fédérale se développe selon 4 axes : BANCASSURANCE: La bancassurance propose une offre intégrée correspondant aux besoins de nos sociétaires en banque et en assurance. MUTUALISME: Notre manière d'être et d'agir repose sur le respect et la confiance. L'intérêt du sociétaire prime sur la structure. TECHNOLOGIE: Nous maîtrisons les technologies nouvelles, pour les mettre au service des sociétaires et des Caisses. BANQUE DE PROXIMITÉ Concernant le Crédit Mutuel, la relation avec le sociétaire est assurée par des Caisses autonomes, impliquées dans le tissu local. par l'utilisation des outils de banque à distance. Avec le rachat du CIC en 1998, le Groupe Crédit Mutuel Alliance Fédérale accède à un réseau international présent sur tous les continents. Sur cette base, la stratégie de développement international va notamment s'appuyer sur l'expertise du Groupe en matière de bancassurance et de flux monétiques ainsi que sur les assurances et le crédit à la consommation. Aujourd'hui le Groupe Crédit Mutuel Alliance Fédérale poursuit son internationalisation. Mission Mission principale Le Conseiller de Clientèle / Chargé de Clientèle Particuliers développe, gère et fidélise un portefeuille de clients particuliers « coeur de cible » Dans le cadre d' une approche par univers de besoins, il leur vend les produits et services bancassurances optimisant leur équipement et leur permettant de réaliser leurs projets. Il vise la maîtrise des risques et la rentabilité de son portefeuille. Par des actions de recommandation et de prospection, il assure l'enrichissement et le renouvellement de son portefeuille et contribue au développement commercial de son agence. Dans certaines organisations, il exerce des activités de guichet et/ou de maintenance des automates. Activités / Tâches spécifiques du poste Le Conseiller de Clientèle / Chargé de Clientèle Particuliers : Prépare, organise et suit son activité commerciale  Prépare et conduit ses entretiens : Mobilise les spécialistes lorsque les besoins des clients le nécessitent.  Conquiert de nouveaux clients : Sollicite des recommandations ; développe la prescription. Conduit les actions de prospection (hors recommandation).  Assure le suivi de la relation  Analyse les risques, anticipe et gére leur dégradation Profil Connaissances et compétences Expérience confirmée dans le métier de Conseiller Bancaire/Conseiller Clientèle - Compétences commerciales démontrées Maîtrise de la gestion des risques (risques naissants, suivi débiteurs, pré-contentieux...) Capable de procéder à des analyses de rentabilité et de risques Savoir mener et concrétiser un entretien de vente Bonne culture économique (notamment du tissu économique local) Savoir-être - savoir-faire Bonne expression écrite et orale Aisance relationnelle, écoute Rigueur, organisation et autonomie Disponibilité, réactivité et dynamisme motivation commerciale, force de conviction, capacité d'adaptation, empathie Savoir communiquer et travailler en équipe Savoir faire preuve de pédagogie. Certification(s)/Accréditation(s) AMF indispensable. Avantages Rémunération fixe versée sur 13 mois RTT Intéressement, participation et abondement Plan épargne entreprise et PERCO Contrat de santé collectif Prévoyance Retraite supplémentaire prise en charge à 100% par l’employeur Conditions bancaires et assurances préférentielles Politique parentale avantageuse  Société : CCM PONTARLIER | Réf. : A038804 | Date de publication : 01/04/2021 Credit Mutuel Il y a plus de 30 jours - Continuer pour postuler Signaler l'offre"
39,Adjoint.e Directeur.trice d'Agence,Société Générale BDDF Service Client,32 000 € - 39 000 € par an,"VOS MISSIONS AU QUOTIDIEN Vous avez à cœur d’embarquer vos collaborateurs.trices dans de nouvelles aventures, tout en continuant de conseiller vos client.e.s ? En tant qu’Adjoint.e Directeur.trice d’agence, vous aurez pour mission d’accompagner le.la Directeur.trice d’agence dans l’animation et l’encadrement de votre équipe. Concrètement, vous serez amené.e à : - Seconder et accompagner le.la directeur.trice. d'agence dans l'animation, l'encadrement et le développement de l'équipe - Gérer et développer le portefeuille de clients et de prospects qui vous est confié - Proposer des produits et services personnalisés et travailler en synergie avec des Conseiller.e.s spécialisé.e.s pour des demandes clients spécifiques - Favoriser l’autonomie client et la promotion de la vente à distance et du digital - Assurer la maîtrise du risque et le respect des procédures en matière de conformité ET SI C’ÉTAIT VOUS ? Vous êtes diplômé.e d’un Bac + 5 en banque/assurance, finance ou commerce, avec une expérience réussie comme Conseiller.e de clientèle ou Adjoint.e Directeur.trice d’équipe - L’offre bancaire destinée à la clientèle privée, ainsi que les risques et procédures associés, n’ont plus de secret pour vous - Réactif.ve et rigoureux.se, vous êtes à l’écoute de vos collaborateurs comme de vos clients - Vous avez une appétence pour le management, la fibre commerciale et le sens des responsabilités PLUS QU’UN POSTE, UN TREMPLIN Le job d’Adjoint.e Directeur.trice d’Agence est une fonction clé pour découvrir notre réseau Banque de Détail. Grâce à nos programmes de formation personnalisés et à la mobilité interne, vous pourrez évoluer sur un poste de Directeur.trice d’agence ou sur des postes d’expertise comme Conseiller.e en gestion de patrimoine ou Conseiller.e clientèle professionnels POURQUOI NOUS CHOISIR ? Chez Société Générale, nous sommes convaincus que les personnes sont moteurs du changement, et que le monde de demain sera fait de toutes leurs initiatives, des plus petites aux plus ambitieuses. Que vous nous rejoigniez pour quelques mois, quelques années ou toute votre carrière, ensemble nous avons les moyens d’avoir un impact positif sur l’avenir. Créer, oser, innover, entreprendre font partie de notre ADN. Si vous aussi vous souhaitez être dans l’action, évoluer dans un environnement stimulant et bienveillant, vous sentir utile au quotidien et développer ou renforcer votre expertise, nous sommes faits pour nous rencontrer ! Vous hésitez encore ? Sachez que nos collaborateurs peuvent s’engager quelques jours par an pour des actions de solidarité sur leur temps de travail : parrainer des personnes en difficulté dans leur orientation ou leur insertion professionnelle, participer à l’éducation financière de jeunes en apprentissage ou encore partager leurs compétences avec une association. Les formats d’engagement sont multiples. Statut : Cadre Type d'emploi : Temps plein, CDI Salaire : 32 000,00€ à 39 000,00€ par an Avantages : Épargne salariale Participation au Transport RTT Titre-restaurant Travail à Distance Horaires : Périodes de Travail de 8 Heures Rémunération supplémentaire : 13ème Mois Prime annuelle Précautions contre le COVID-19: Processus de recrutement à distance Équipement de protection individuel fourni ou requis Consignes de distanciation sociale Entretiens virtuels Aujourd'hui Signaler l'offre"
40,Chargé de Gestion Sinistres - Responsabilité Civil Médicale...,Crédit Agricole Assurances,,"Description du poste Le service sinistres Responsabilité Civile Professionnelle, qui comprend 13 collaborateurs, a pour mission de gérer des sinistres dans lesquels la responsabilité civile des professionnels de santé est mise en jeu.  Il recherche actuellement un juriste pour venir renforcer l’équipe. Et concrètement, de quoi s’agit-il sur le terrain ?  Vos principales missions seront : traitement des dossiers de l'ouverture à la clôture saisine des différents intervenants ( médecins, avocats...) étude des responsabilités et des garanties instruction des dossiers et indemnisation des victimes évaluation et suivi des coûts techniques et détection des dossiers lourds Dans le cadre de votre prise de poste, vous serez, bien entendu, accompagné et intégré par l’équipe pour une montée en compétence progressive. Vous hésitez encore à nous rejoindre ? Sachez que l’humain est au cœur du Plan Moyen Terme (PMT) de Crédit Agricole Assurances afin « d’agir chaque jour dans l’intérêt de nos clients et de la société », la raison d’être de notre groupe. Et après ? En rejoignant CAA, vous rejoignez aussi le Groupe Crédit Agricole SA et c’est tout autant d’opportunités qui s’offrent à vous dans le cadre de votre carrière. Alors, prenez part à l’aventure !  Critères de candidature Date de prise de fonction 03/05/2021 Durée 7 Poste avec management Non Cadre / Non Cadre Cadre Niveau d'étude minimum Bac + 5 / M2 et plus Formation / Spécialisation Vous avez obtenu un diplôme dans le domaine juridique de niveau MASTER en RC Médicale ou droit des assurances. Vous maitrisez les règles de droit en RC médicale et êtes compétent dans l'évaluation des préjudices corporels (compétences techniques et outils). Niveau d'expérience minimum 0 - 2 ans Soft skills Votre personnalité est tout aussi importante que vos compétences techniques. Si vous êtes doté d'un bon relationnel, orienté client et prêt à rejoindre une équipe dynamique, mais également reconnu pour votre rigueur, votre pugnacité, votre organisation, votre réactivité et votre sens de l'analyse ; Vous avez certainement le profil que nous recherchons ! Entreprise Crédit Agricole Assurances Crédit Agricole Assurances, premier assureur en France, rassemble les filiales assurances du Crédit Agricole. Le groupe propose une gamme de produits et services en épargne, retraite, santé, prévoyance et assurance des biens. Ils sont distribués par les banques du groupe Crédit Agricole en France et dans 7 pays dans le monde, par des conseillers en gestion patrimoniale et des agents généraux. Les compagnies de Crédit Agricole Assurances s'adressent aux particuliers, professionnels, agriculteurs et entreprises. A fin 2019, Crédit Agricole Assurances compte 4 700 collaborateurs et son chiffre d'affaires s'élève à 37 milliards d'euros (normes IFRS). La Médicale, filiale de Crédit Agricole Assurances, est une compagnie leader, spécialisée dans le domaine de l'assurance des professionnels de santé. Avec son réseau de 125 agents généraux dédiés, elle s'adresse aux médecins généralistes et spécialistes, pharmaciens, chirurgiens-dentistes, vétérinaires et professions paramédicales, qu'ils exercent en libéral ou en milieu hospitalier. A ses clients, La Médicale propose une gamme complète de produits d'assurances adaptés à leurs besoins, ainsi qu'à leurs proches, à chaque moment de leur vie professionnelle et privée. La Médicale en 2019, ce sont plus de 200 collaborateurs et 45 agences. Groupe Crédit Agricole il y a 10 jours - Continuer pour postuler Signaler l'offre"
41,Conseiller client à distance F/H,CBP FRANCE,,"Qui sommes-nous ?  Chez Cbp, nous sommes plus de 700 collaborateurs dédiés au quotidien à la satisfaction de nos partenaires (assureurs), nos clients (banques, courtiers en crédits, organismes spécialisés, grande distribution…) et nos assurés dans le cadre de nos activités de courtage (conseil & accompagnement expert) et de gestion de contrats par délégation, en assurance de prêt et en prévoyance individuelle. Pour nous découvrir un peu plus et bien comprendre qui nous sommes, c’est par ici www.cbp-group.com  Quelles seront vos activités ?  Vous accueillez, conseillez et accompagnez nos clients professionnels (partenaires bancaires, courtiers etc…) et particuliers (postulants, assurés) dans toutes leurs démarches relatives à leur contrat d’assurance emprunteur (constitution de dossier, suivi d’avancement, résolution d’incident sur les outils en ligne etc…). Sourire, accueil, analyse et réactivité sont votre quotidien, et vous permettent d’apporter à l’ensemble de nos clients, un service de qualité par la réponse la plus adaptée. Votre aisance avec les nouvelles technologies fait par ailleurs de vous un conseiller précieux pour nos clients dans leur utilisation de nos services et outils digitaux. Pourquoi rejoindre notre Centre de relation client ? Parce qu’il y fait bon vivre Bonne humeur, solidarité et partage sont les valeurs immuables de notre équipe. Nous veillons à ce que vous ne vous sentiez jamais seul dans l’entreprise. Nous vous proposons une amplitude horaire compatible avec une vie personnelle ! Parce que vous avez le temps d’apprendre notre métier L’assurance emprunteur est une inconnue pour vous ? Pas de panique, votre intégration chez Cbp commencera par une formation de 3 semaines combinant connaissances théoriques, training, jeux de rôle, double-écoutes… jusqu’à vous sentir à l’aise pour décrocher votre premier appel. Votre manager vous encourage et vous accompagne tout au long de votre développement et progression. Pour notre spécificité : appels entrants et traitement de messages uniquement en matière de conseil et d’accompagnement pas de vente  Et vous ? Vous êtes une personne enthousiaste, positive et agréable au quotidien ! Vous êtes diplômé d’un Bac+ 2/3 de type BTS ou équivalent universitaire ? Vous êtes curieux et avez l’envie de découvrir un nouveau domaine, d’apprendre un nouveau métier ? Vous avez le sens du service et une réelle appétence pour la relation clientèle ? Vous souhaitez évoluer dans un environnement de travail sympa, dynamique et collaboratif ?  Vous vous interrogez sur les conditions pour nous rejoindre ? Nous vous proposons deux postes en CDI, avec démarrage au 3 mai :  Vous bénéficiez d’une rémunération fixe répartie sur 13,5 mois, hors prime d’intéressement et de participation. Vous disposez également de RTT, de titres restaurants ainsi que d’un contrat frais de santé et de prévoyance. Vous pourrez profiter chaque jour d’un environnement agréable et apprécié de tous : Locaux récents, chaleureux et accueillants Nos événements organisés tout au long de l’année vous permettent de vous ouvrir à de nouveaux horizons et de participer à des actions de développement durable et solidaire il y a 8 jours - Continuer pour postuler Signaler l'offre"
